{
    "work_order_id":  "WO-20260520-120958-plan-and-scope-director-goal-studio-",
    "source_type":  "director_goal",
    "source_ref":  "DGP-20260520-120958-studio-ux-improvement-goal-home-huma",
    "objective":  "Plan and scope Director goal: Studio UX improvement goal: Home 화면에서 Human Director가 지금 판단해야 할 일, 최근 작업 상태, 다음 행동을 더 직관적으로 이해할 수 있게 개선 방향을 기획해줘.",
    "department_id":  "executive_production",
    "assigned_agents":  [
                            "executive_producer",
                            "technical_architect",
                            "gameplay_programmer",
                            "qa_tester"
                        ],
    "scope":  [
                  "감독자 목표를 실행 가능한 업무 후보로 분해: Studio UX improvement goal: Home 화면에서 Human Director가 지금 판단해야 할 일, 최근 작업 상태, 다음 행동을 더 직관적으로 이해할 수 있게 개선 방향을 기획해줘.",
                  "부서/직원/회의/업무지시/승인 항목을 분리해서 제안합니다.",
                  "승인 전에는 공식 설정, 소스 수정, task 실행, commit/push를 하지 않습니다."
              ],
    "non_goals":  [
                      "이 기획안만으로 공식 설정을 확정하지 않습니다.",
                      "이 기획안만으로 소스, 데이터, 에셋, 문서를 수정하지 않습니다.",
                      "이 기획안만으로 AIWorkflow task를 done 처리하거나 commit/push하지 않습니다.",
                      "감독자 제약 유지: 구현은 하지 말고",
                      "감독자 제약 유지: 필요한 부서/AI 직원 역할",
                      "감독자 제약 유지: 제안안",
                      "감독자 제약 유지: 승인 필요 항목",
                      "감독자 제약 유지: 후속 WorkOrder 후보만 정리해줘. Discord 기능은 이번 범위에서 제외해."
                  ],
    "expected_outputs":  [
                             "감독자가 읽을 수 있는 목표 분해안",
                             "승인 필요 항목 목록",
                             "후속 회의/업무/제안 후보",
                             "검증 자료 요구사항"
                         ],
    "approval_items":  [
                           {
                               "type":  "scope",
                               "plain_language_summary":  "감독자 목표를 Studio 업무 후보로 분해하는 것만 승인합니다.",
                               "what_will_change":  [
                                                        "감독자 목표를 실행 가능한 업무 후보로 분해: Studio UX improvement goal: Home 화면에서 Human Director가 지금 판단해야 할 일, 최근 작업 상태, 다음 행동을 더 직관적으로 이해할 수 있게 개선 방향을 기획해줘.",
                                                        "부서/직원/회의/업무지시/승인 항목을 분리해서 제안합니다.",
                                                        "승인 전에는 공식 설정, 소스 수정, task 실행, commit/push를 하지 않습니다."
                                                    ],
                               "what_will_not_change":  [
                                                            "이 기획안만으로 공식 설정을 확정하지 않습니다.",
                                                            "이 기획안만으로 소스, 데이터, 에셋, 문서를 수정하지 않습니다.",
                                                            "이 기획안만으로 AIWorkflow task를 done 처리하거나 commit/push하지 않습니다.",
                                                            "감독자 제약 유지: 구현은 하지 말고",
                                                            "감독자 제약 유지: 필요한 부서/AI 직원 역할",
                                                            "감독자 제약 유지: 제안안",
                                                            "감독자 제약 유지: 승인 필요 항목",
                                                            "감독자 제약 유지: 후속 WorkOrder 후보만 정리해줘. Discord 기능은 이번 범위에서 제외해."
                                                        ],
                               "files_or_memory_affected":  [

                                                            ],
                               "risks":  [

                                         ],
                               "rollback_plan":  [

                                                 ],
                               "evidence_required":  [
                                                         "후보가 승인 전 실행/공식 설정/소스 수정/commit/push를 하지 않는지 확인합니다.",
                                                         "부서/직원/승인 항목이 목표와 직접 연결되는지 확인합니다.",
                                                         "후속 업무가 너무 크면 더 작은 WorkOrder로 나눕니다."
                                                     ]
                           }
                       ],
    "evidence_requirements":  [

                              ],
    "verification_plan":  [
                              "후보가 승인 전 실행/공식 설정/소스 수정/commit/push를 하지 않는지 확인합니다.",
                              "부서/직원/승인 항목이 목표와 직접 연결되는지 확인합니다.",
                              "후속 업무가 너무 크면 더 작은 WorkOrder로 나눕니다."
                          ],
    "handoff_plan":  [

                     ],
    "target_project_profile":  "dustland_custom_cpp_prototype",
    "status":  "director_review"
}
